{
  "$schema": "../../schemas/accessibility-baseline.schema.json",
  "schemaVersion": "1.0.0",
  "capturedOn": "2026-07-25",
  "runner": {
    "name": "axe-core",
    "version": "4.11.1",
    "storybook": "10.3.3"
  },
  "knownViolations": [
    {
      "storyId": "components-autocomplete--all-variations",
      "rule": "color-contrast",
      "target": "#react-aria2529365808-_r_28_",
      "impact": "serious"
    },
    {
      "storyId": "components-autocomplete--all-variations",
      "rule": "color-contrast",
      "target": "#react-aria2529365808-_r_2f_",
      "impact": "serious"
    },
    {
      "storyId": "components-autocomplete--all-variations",
      "rule": "scrollable-region-focusable",
      "target": "#storybook-root > div > div:nth-child(1) > div:nth-child(2) > div:nth-child(2)",
      "impact": "serious"
    },
    {
      "storyId": "components-badge--all-variations",
      "rule": "color-contrast",
      "target": ".color-amber.tale-badge--lg.tale-badge--rounded",
      "impact": "serious"
    },
    {
      "storyId": "components-badge--all-variations",
      "rule": "color-contrast",
      "target": ".color-amber.tale-badge--md.tale-badge--rounded",
      "impact": "serious"
    },
    {
      "storyId": "components-badge--all-variations",
      "rule": "color-contrast",
      "target": ".color-amber.tale-badge--sm.tale-badge--rounded",
      "impact": "serious"
    },
    {
      "storyId": "components-badge--all-variations",
      "rule": "color-contrast",
      "target": ".color-cyan.tale-badge--lg.tale-badge--rounded",
      "impact": "serious"
    },
    {
      "storyId": "components-badge--all-variations",
      "rule": "color-contrast",
      "target": ".color-cyan.tale-badge--md.tale-badge--rounded",
      "impact": "serious"
    },
    {
      "storyId": "components-badge--all-variations",
      "rule": "color-contrast",
      "target": ".color-cyan.tale-badge--sm.tale-badge--rounded",
      "impact": "serious"
    },
    {
      "storyId": "components-badge--all-variations",
      "rule": "color-contrast",
      "target": ".color-emerald.tale-badge--lg.tale-badge--rounded",
      "impact": "serious"
    },
    {
      "storyId": "components-badge--all-variations",
      "rule": "color-contrast",
      "target": ".color-emerald.tale-badge--md.tale-badge--rounded",
      "impact": "serious"
    },
    {
      "storyId": "components-badge--all-variations",
      "rule": "color-contrast",
      "target": ".color-emerald.tale-badge--sm.tale-badge--rounded",
      "impact": "serious"
    },
    {
      "storyId": "components-badge--all-variations",
      "rule": "color-contrast",
      "target": ".color-green.tale-badge--lg.tale-badge--rounded",
      "impact": "serious"
    },
    {
      "storyId": "components-badge--all-variations",
      "rule": "color-contrast",
      "target": ".color-green.tale-badge--md.tale-badge--rounded",
      "impact": "serious"
    },
    {
      "storyId": "components-badge--all-variations",
      "rule": "color-contrast",
      "target": ".color-green.tale-badge--sm.tale-badge--rounded",
      "impact": "serious"
    },
    {
      "storyId": "components-badge--all-variations",
      "rule": "color-contrast",
      "target": ".color-lime.tale-badge--lg.tale-badge--rounded",
      "impact": "serious"
    },
    {
      "storyId": "components-badge--all-variations",
      "rule": "color-contrast",
      "target": ".color-lime.tale-badge--md.tale-badge--rounded",
      "impact": "serious"
    },
    {
      "storyId": "components-badge--all-variations",
      "rule": "color-contrast",
      "target": ".color-lime.tale-badge--sm.tale-badge--rounded",
      "impact": "serious"
    },
    {
      "storyId": "components-badge--all-variations",
      "rule": "color-contrast",
      "target": ".color-orange.tale-badge--lg.tale-badge--rounded",
      "impact": "serious"
    },
    {
      "storyId": "components-badge--all-variations",
      "rule": "color-contrast",
      "target": ".color-orange.tale-badge--md.tale-badge--rounded",
      "impact": "serious"
    },
    {
      "storyId": "components-badge--all-variations",
      "rule": "color-contrast",
      "target": ".color-orange.tale-badge--sm.tale-badge--rounded",
      "impact": "serious"
    },
    {
      "storyId": "components-badge--all-variations",
      "rule": "color-contrast",
      "target": ".color-red.tale-badge--lg.tale-badge--rounded",
      "impact": "serious"
    },
    {
      "storyId": "components-badge--all-variations",
      "rule": "color-contrast",
      "target": ".color-red.tale-badge--md.tale-badge--rounded",
      "impact": "serious"
    },
    {
      "storyId": "components-badge--all-variations",
      "rule": "color-contrast",
      "target": ".color-red.tale-badge--sm.tale-badge--rounded",
      "impact": "serious"
    },
    {
      "storyId": "components-badge--all-variations",
      "rule": "color-contrast",
      "target": ".color-sky.tale-badge--lg.tale-badge--rounded",
      "impact": "serious"
    },
    {
      "storyId": "components-badge--all-variations",
      "rule": "color-contrast",
      "target": ".color-sky.tale-badge--md.tale-badge--rounded",
      "impact": "serious"
    },
    {
      "storyId": "components-badge--all-variations",
      "rule": "color-contrast",
      "target": ".color-sky.tale-badge--sm.tale-badge--rounded",
      "impact": "serious"
    },
    {
      "storyId": "components-badge--all-variations",
      "rule": "color-contrast",
      "target": ".color-success.tale-badge--lg.tale-badge--rounded",
      "impact": "serious"
    },
    {
      "storyId": "components-badge--all-variations",
      "rule": "color-contrast",
      "target": ".color-success.tale-badge--md.tale-badge--rounded",
      "impact": "serious"
    },
    {
      "storyId": "components-badge--all-variations",
      "rule": "color-contrast",
      "target": ".color-success.tale-badge--sm.tale-badge--rounded",
      "impact": "serious"
    },
    {
      "storyId": "components-badge--all-variations",
      "rule": "color-contrast",
      "target": ".color-teal.tale-badge--lg.tale-badge--rounded",
      "impact": "serious"
    },
    {
      "storyId": "components-badge--all-variations",
      "rule": "color-contrast",
      "target": ".color-teal.tale-badge--md.tale-badge--rounded",
      "impact": "serious"
    },
    {
      "storyId": "components-badge--all-variations",
      "rule": "color-contrast",
      "target": ".color-teal.tale-badge--sm.tale-badge--rounded",
      "impact": "serious"
    },
    {
      "storyId": "components-badge--all-variations",
      "rule": "color-contrast",
      "target": ".color-warning.tale-badge--lg.tale-badge--rounded",
      "impact": "serious"
    },
    {
      "storyId": "components-badge--all-variations",
      "rule": "color-contrast",
      "target": ".color-warning.tale-badge--md.tale-badge--rounded",
      "impact": "serious"
    },
    {
      "storyId": "components-badge--all-variations",
      "rule": "color-contrast",
      "target": ".color-warning.tale-badge--sm.tale-badge--rounded",
      "impact": "serious"
    },
    {
      "storyId": "components-badge--all-variations",
      "rule": "color-contrast",
      "target": ".color-yellow.tale-badge--lg.tale-badge--rounded",
      "impact": "serious"
    },
    {
      "storyId": "components-badge--all-variations",
      "rule": "color-contrast",
      "target": ".color-yellow.tale-badge--md.tale-badge--rounded",
      "impact": "serious"
    },
    {
      "storyId": "components-badge--all-variations",
      "rule": "color-contrast",
      "target": ".color-yellow.tale-badge--sm.tale-badge--rounded",
      "impact": "serious"
    },
    {
      "storyId": "components-badge--all-variations",
      "rule": "color-contrast",
      "target": "div:nth-child(1) > div:nth-child(2) > .color-amber.tale-badge--lg.tale-badge--color",
      "impact": "serious"
    },
    {
      "storyId": "components-badge--all-variations",
      "rule": "color-contrast",
      "target": "div:nth-child(1) > div:nth-child(2) > .color-amber.tale-badge--md.tale-badge--color",
      "impact": "serious"
    },
    {
      "storyId": "components-badge--all-variations",
      "rule": "color-contrast",
      "target": "div:nth-child(1) > div:nth-child(2) > .color-amber.tale-badge--sm.tale-badge--color",
      "impact": "serious"
    },
    {
      "storyId": "components-badge--all-variations",
      "rule": "color-contrast",
      "target": "div:nth-child(1) > div:nth-child(2) > .color-cyan.tale-badge--lg.tale-badge--color",
      "impact": "serious"
    },
    {
      "storyId": "components-badge--all-variations",
      "rule": "color-contrast",
      "target": "div:nth-child(1) > div:nth-child(2) > .color-cyan.tale-badge--md.tale-badge--color",
      "impact": "serious"
    },
    {
      "storyId": "components-badge--all-variations",
      "rule": "color-contrast",
      "target": "div:nth-child(1) > div:nth-child(2) > .color-cyan.tale-badge--sm.tale-badge--color",
      "impact": "serious"
    },
    {
      "storyId": "components-badge--all-variations",
      "rule": "color-contrast",
      "target": "div:nth-child(1) > div:nth-child(2) > .color-emerald.tale-badge--lg.tale-badge--color",
      "impact": "serious"
    },
    {
      "storyId": "components-badge--all-variations",
      "rule": "color-contrast",
      "target": "div:nth-child(1) > div:nth-child(2) > .color-emerald.tale-badge--md.tale-badge--color",
      "impact": "serious"
    },
    {
      "storyId": "components-badge--all-variations",
      "rule": "color-contrast",
      "target": "div:nth-child(1) > div:nth-child(2) > .color-emerald.tale-badge--sm.tale-badge--color",
      "impact": "serious"
    },
    {
      "storyId": "components-badge--all-variations",
      "rule": "color-contrast",
      "target": "div:nth-child(1) > div:nth-child(2) > .color-green.tale-badge--lg.tale-badge--color",
      "impact": "serious"
    },
    {